[2025-11-24 08:15:23] ============================================================
[2025-11-24 08:15:23] CITE-seq Protein Model Training
[2025-11-24 08:15:23] ============================================================
[2025-11-24 08:15:23] Using default GPU settings
[2025-11-24 08:15:23] Protein Model Training started at: 20251124_081523
[2025-11-24 08:15:23] Available GPUs: 4
[2025-11-24 08:15:23] Using default GPU 0: cuda:0
[2025-11-24 08:15:24] Loading CITE-seq protein data...
[2025-11-24 08:15:28] Training data shape: (12345, 140)
[2025-11-24 08:15:28] Test data shape: (3456, 140)
[2025-11-24 08:15:28] Processing protein consistency...
[2025-11-24 08:15:29] Training proteins: 140
[2025-11-24 08:15:29] Test proteins: 140
[2025-11-24 08:15:29] Common proteins: 140
[2025-11-24 08:15:32] train set perturbation dimension: 8
[2025-11-24 08:15:32] train set protein dimension: 140
[2025-11-24 08:15:32] Control samples: 1234
[2025-11-24 08:15:32] Perturbed samples: 11111
[2025-11-24 08:15:33] Total pairs created: 12345
[2025-11-24 08:15:35] test set perturbation dimension: 5
[2025-11-24 08:15:35] test set protein dimension: 140
[2025-11-24 08:15:35] Control samples: 345
[2025-11-24 08:15:35] Perturbed samples: 3111
[2025-11-24 08:15:36] Total pairs created: 3456
[2025-11-24 08:15:37] Standardized perturbation encoding: 13 dimensions
[2025-11-24 08:15:37] All perturbation types: ["IFNG", "TGFB1", "TNF", "control", "IFNG+TGFB1", "IFNG+TNF", "TGFB1+TNF", "IFNG+TGFB1+TNF", "IFNG+TGFB1+TNF+IL2", "IFNG+TGFB1+TNF+IL2+IL4", "IFNG+TGFB1+TNF+IL2+IL4+IL6", "IFNG+TGFB1+TNF+IL2+IL4+IL6+IL10", "IFNG+TGFB1+TNF+IL2+IL4+IL6+IL10+IL12"]
[2025-11-24 08:15:38] Starting hyperparameter optimization...
[2025-11-24 08:23:12] Control samples: 1234
[2025-11-24 08:23:12] Perturbed samples: 11111
[2025-11-24 08:23:12] Perturbation dimension: 8
[2025-11-24 08:23:12] Using 1234 true control samples as baseline
[2025-11-24 08:23:12] Total pairs created: 12345
[2025-11-24 08:23:12] Dataset created: 12345 pairs, 140 features
[2025-11-24 08:23:12] Standardized perturbation encoding: 13 dimensions
[2025-11-24 08:29:22] Control samples: 1234
[2025-11-24 08:29:22] Perturbed samples: 11111
[2025-11-24 08:29:22] Perturbation dimension: 8
[2025-11-24 08:29:22] Using 1234 true control samples as baseline
[2025-11-24 08:29:22] Total pairs created: 12345
[2025-11-24 08:29:22] Dataset created: 12345 pairs, 140 features
[2025-11-24 08:29:22] Standardized perturbation encoding: 13 dimensions
[2025-11-24 08:34:04] Control samples: 1234
[2025-11-24 08:34:04] Perturbed samples: 11111
[2025-11-24 08:34:04] Perturbation dimension: 8
[2025-11-24 08:34:04] Using 1234 true control samples as baseline
[2025-11-24 08:34:04] Total pairs created: 12345
[2025-11-24 08:34:04] Dataset created: 12345 pairs, 140 features
[2025-11-24 08:34:04] Standardized perturbation encoding: 13 dimensions
[2025-11-24 08:40:01] Control samples: 1234
[2025-11-24 08:40:01] Perturbed samples: 11111
[2025-11-24 08:40:01] Perturbation dimension: 8
[2025-11-24 08:40:01] Using 1234 true control samples as baseline
[2025-11-24 08:40:01] Total pairs created: 12345
[2025-11-24 08:40:01] Dataset created: 12345 pairs, 140 features
[2025-11-24 08:40:01] Standardized perturbation encoding: 13 dimensions
[2025-11-24 08:44:50] Control samples: 1234
[2025-11-24 08:44:50] Perturbed samples: 11111
[2025-11-24 08:44:50] Perturbation dimension: 8
[2025-11-24 08:44:50] Using 1234 true control samples as baseline
[2025-11-24 08:44:50] Total pairs created: 12345
[2025-11-24 08:44:50] Dataset created: 12345 pairs, 140 features
[2025-11-24 08:44:50] Standardized perturbation encoding: 13 dimensions
[2025-11-24 08:49:47] Control samples: 1234
[2025-11-24 08:49:47] Perturbed samples: 11111
[2025-11-24 08:49:47] Perturbation dimension: 8
[2025-11-24 08:49:47] Using 1234 true control samples as baseline
[2025-11-24 08:49:47] Total pairs created: 12345
[2025-11-24 08:49:47] Dataset created: 12345 pairs, 140 features
[2025-11-24 08:49:47] Standardized perturbation encoding: 13 dimensions
[2025-11-24 08:55:12] Control samples: 1234
[2025-11-24 08:55:12] Perturbed samples: 11111
[2025-11-24 08:55:12] Perturbation dimension: 8
[2025-11-24 08:55:12] Using 1234 true control samples as baseline
[2025-11-24 08:55:12] Total pairs created: 12345
[2025-11-24 08:55:12] Dataset created: 12345 pairs, 140 features
[2025-11-24 08:55:12] Standardized perturbation encoding: 13 dimensions
[2025-11-24 09:01:11] Control samples: 1234
[2025-11-24 09:01:11] Perturbed samples: 11111
[2025-11-24 09:01:11] Perturbation dimension: 8
[2025-11-24 09:01:11] Using 1234 true control samples as baseline
[2025-11-24 09:01:11] Total pairs created: 12345
[2025-11-24 09:01:11] Dataset created: 12345 pairs, 140 features
[2025-11-24 09:01:11] Standardized perturbation encoding: 13 dimensions
[2025-11-24 09:07:22] Control samples: 1234
[2025-11-24 09:07:22] Perturbed samples: 11111
[2025-11-24 09:07:22] Perturbation dimension: 8
[2025-11-24 09:07:22] Using 1234 true control samples as baseline
[2025-11-24 09:07:22] Total pairs created: 12345
[2025-11-24 09:07:22] Dataset created: 12345 pairs, 140 features
[2025-11-24 09:07:22] Standardized perturbation encoding: 13 dimensions
[2025-11-24 09:12:34] Control samples: 1234
[2025-11-24 09:12:34] Perturbed samples: 11111
[2025-11-24 09:12:34] Perturbation dimension: 8
[2025-11-24 09:12:34] Using 1234 true control samples as baseline
[2025-11-24 09:12:34] Total pairs created: 12345
[2025-11-24 09:12:34] Dataset created: 12345 pairs, 140 features
[2025-11-24 09:12:34] Standardized perturbation encoding: 13 dimensions
[2025-11-24 10:50:23] Best parameters:
[2025-11-24 10:50:23] n_hidden: 256
[2025-11-24 10:50:23] n_layers: 3
[2025-11-24 10:50:23] n_heads: 4
[2025-11-24 10:50:23] dropout: 0.15
[2025-11-24 10:50:23] attention_dropout: 0.12
[2025-11-24 10:50:23] ffn_dropout: 0.12
[2025-11-24 10:50:23] aux_weight: 0.05
[2025-11-24 10:50:23] learning_rate: 0.0003
[2025-11-24 10:50:23] weight_decay: 0.00005
[2025-11-24 10:50:23] batch_size: 128
[2025-11-24 10:50:23] use_gat: True
[2025-11-24 10:50:23] gat_layers: 2
[2025-11-24 10:50:23] use_cross_attn: True
[2025-11-24 10:50:23] Training final model with best parameters...
Training:   0%|          | 0/96 [00:00<?, ?it/s]
Training:   2%|▏         | 2/96 [00:36<28:12, 0.06it/s]
Training:   4%|▍         | 4/96 [01:12<27:36, 0.06it/s]
Training:   7%|▋         | 7/96 [02:06<26:42, 0.06it/s]
Training:   9%|▉         | 9/96 [02:42<26:06, 0.06it/s]
Training:  11%|█▏        | 11/96 [03:18<25:30, 0.06it/s]
Training:  14%|█▍        | 14/96 [04:12<24:36, 0.06it/s]
Training:  16%|█▋        | 16/96 [04:48<24:00, 0.06it/s]
Training:  19%|█▉        | 19/96 [05:42<23:06, 0.06it/s]
Training:  21%|██▏       | 21/96 [06:18<22:30, 0.06it/s]
Training:  25%|██▌       | 24/96 [07:12<21:36, 0.06it/s]
Training:  26%|██▌       | 25/96 [07:30<21:18, 0.06it/s]
Training:  29%|██▉       | 28/96 [08:24<20:24, 0.06it/s]
Training:  31%|███▏      | 30/96 [09:00<19:48, 0.06it/s]
Training:  34%|███▍      | 33/96 [09:54<18:54, 0.06it/s]
Training:  36%|███▋      | 35/96 [10:30<18:18, 0.06it/s]
Training:  39%|███▉      | 38/96 [11:24<17:24, 0.06it/s]
Training:  41%|████▏     | 40/96 [12:00<16:48, 0.06it/s]
Training:  44%|████▍     | 43/96 [12:54<15:54, 0.06it/s]
Training:  46%|████▋     | 45/96 [13:30<15:18, 0.06it/s]
Training:  50%|█████     | 48/96 [14:24<14:24, 0.06it/s]
Training:  51%|█████     | 49/96 [14:42<14:06, 0.06it/s]
Training:  54%|█████▍    | 52/96 [15:36<13:12, 0.06it/s]
Training:  56%|█████▋    | 54/96 [16:12<12:36, 0.06it/s]
Training:  59%|█████▉    | 57/96 [17:06<11:42, 0.06it/s]
Training:  61%|██████▏   | 59/96 [17:42<11:06, 0.06it/s]
Training:  64%|██████▍   | 62/96 [18:36<10:12, 0.06it/s]
Training:  66%|██████▋   | 64/96 [19:12<09:36, 0.06it/s]
Training:  69%|██████▉   | 67/96 [20:06<08:42, 0.06it/s]
Training:  71%|███████▏  | 69/96 [20:42<08:06, 0.06it/s]
Training:  75%|███████▌  | 72/96 [21:36<07:12, 0.06it/s]
Training:  76%|███████▌  | 73/96 [21:54<06:54, 0.06it/s]
Training:  79%|███████▉  | 76/96 [22:48<06:00, 0.06it/s]
Training:  81%|████████▏ | 78/96 [23:24<05:24, 0.06it/s]
Training:  84%|████████▍ | 81/96 [24:18<04:30, 0.06it/s]
Training:  86%|████████▋ | 83/96 [24:54<03:54, 0.06it/s]
Training:  89%|████████▉ | 86/96 [25:48<03:00, 0.06it/s]
Training:  91%|█████████▏| 88/96 [26:24<02:24, 0.06it/s]
Training:  94%|█████████▍| 91/96 [27:18<01:30, 0.06it/s]
Training:  96%|█████████▋| 93/96 [27:54<00:54, 0.06it/s]
Training: 100%|██████████| 96/96 [28:48<00:00, 0.06it/s]
Evaluating:   0%|          | 0/27 [00:00<?, ?it/s]
Evaluating:   3%|▎         | 1/27 [00:06<02:36, 0.17it/s]
Evaluating:   3%|▎         | 1/27 [00:06<02:36, 0.17it/s]
Evaluating:   7%|▋         | 2/27 [00:12<02:30, 0.17it/s]
Evaluating:  14%|█▍        | 4/27 [00:24<02:18, 0.17it/s]
Evaluating:  18%|█▊        | 5/27 [00:30<02:12, 0.17it/s]
Evaluating:  18%|█▊        | 5/27 [00:30<02:12, 0.17it/s]
Evaluating:  25%|██▌       | 7/27 [00:42<02:00, 0.17it/s]
Evaluating:  29%|██▉       | 8/27 [00:48<01:54, 0.17it/s]
Evaluating:  29%|██▉       | 8/27 [00:48<01:54, 0.17it/s]
Evaluating:  33%|███▎      | 9/27 [00:54<01:48, 0.17it/s]
Evaluating:  40%|████      | 11/27 [01:06<01:36, 0.17it/s]
Evaluating:  40%|████      | 11/27 [01:06<01:36, 0.17it/s]
Evaluating:  44%|████▍     | 12/27 [01:12<01:30, 0.17it/s]
Evaluating:  51%|█████▏    | 14/27 [01:24<01:18, 0.17it/s]
Evaluating:  55%|█████▌    | 15/27 [01:30<01:12, 0.17it/s]
Evaluating:  55%|█████▌    | 15/27 [01:30<01:12, 0.17it/s]
Evaluating:  62%|██████▎   | 17/27 [01:42<01:00, 0.17it/s]
Evaluating:  66%|██████▋   | 18/27 [01:48<00:54, 0.17it/s]
Evaluating:  66%|██████▋   | 18/27 [01:48<00:54, 0.17it/s]
Evaluating:  70%|███████   | 19/27 [01:54<00:48, 0.17it/s]
Evaluating:  77%|███████▊  | 21/27 [02:06<00:36, 0.17it/s]
Evaluating:  77%|███████▊  | 21/27 [02:06<00:36, 0.17it/s]
Evaluating:  81%|████████▏ | 22/27 [02:12<00:30, 0.17it/s]
Evaluating:  88%|████████▉ | 24/27 [02:24<00:18, 0.17it/s]
Evaluating:  92%|█████████▎| 25/27 [02:30<00:12, 0.17it/s]
Evaluating:  92%|█████████▎| 25/27 [02:30<00:12, 0.17it/s]
Evaluating: 100%|██████████| 27/27 [02:42<00:00, 0.17it/s]
[2025-11-24 11:20:23] Epoch 20/200:
[2025-11-24 11:20:23] Training Loss: 0.1473
[2025-11-24 11:20:23] Test Loss: 0.1611
Training:   2%|▏         | 2/96 [00:36<28:12, 0.06it/s]
Training:   4%|▍         | 4/96 [01:12<27:36, 0.06it/s]
Training:   7%|▋         | 7/96 [02:06<26:42, 0.06it/s]
Training:   9%|▉         | 9/96 [02:42<26:06, 0.06it/s]
Training:  11%|█▏        | 11/96 [03:18<25:30, 0.06it/s]
Training:  14%|█▍        | 14/96 [04:12<24:36, 0.06it/s]
Training:  16%|█▋        | 16/96 [04:48<24:00, 0.06it/s]
Training:  19%|█▉        | 19/96 [05:42<23:06, 0.06it/s]
Training:  21%|██▏       | 21/96 [06:18<22:30, 0.06it/s]
Training:  25%|██▌       | 24/96 [07:12<21:36, 0.06it/s]
Training:  26%|██▌       | 25/96 [07:30<21:18, 0.06it/s]
Training:  29%|██▉       | 28/96 [08:24<20:24, 0.06it/s]
Training:  31%|███▏      | 30/96 [09:00<19:48, 0.06it/s]
Training:  34%|███▍      | 33/96 [09:54<18:54, 0.06it/s]
Training:  36%|███▋      | 35/96 [10:30<18:18, 0.06it/s]
Training:  39%|███▉      | 38/96 [11:24<17:24, 0.06it/s]
Training:  41%|████▏     | 40/96 [12:00<16:48, 0.06it/s]
Training:  44%|████▍     | 43/96 [12:54<15:54, 0.06it/s]
Training:  46%|████▋     | 45/96 [13:30<15:18, 0.06it/s]
Training:  50%|█████     | 48/96 [14:24<14:24, 0.06it/s]
Training:  51%|█████     | 49/96 [14:42<14:06, 0.06it/s]
Training:  54%|█████▍    | 52/96 [15:36<13:12, 0.06it/s]
Training:  56%|█████▋    | 54/96 [16:12<12:36, 0.06it/s]
Training:  59%|█████▉    | 57/96 [17:06<11:42, 0.06it/s]
Training:  61%|██████▏   | 59/96 [17:42<11:06, 0.06it/s]
Training:  64%|██████▍   | 62/96 [18:36<10:12, 0.06it/s]
Training:  66%|██████▋   | 64/96 [19:12<09:36, 0.06it/s]
Training:  69%|██████▉   | 67/96 [20:06<08:42, 0.06it/s]
Training:  71%|███████▏  | 69/96 [20:42<08:06, 0.06it/s]
Training:  75%|███████▌  | 72/96 [21:36<07:12, 0.06it/s]
Training:  76%|███████▌  | 73/96 [21:54<06:54, 0.06it/s]
Training:  79%|███████▉  | 76/96 [22:48<06:00, 0.06it/s]
Training:  81%|████████▏ | 78/96 [23:24<05:24, 0.06it/s]
Training:  84%|████████▍ | 81/96 [24:18<04:30, 0.06it/s]
Training:  86%|████████▋ | 83/96 [24:54<03:54, 0.06it/s]
Training:  89%|████████▉ | 86/96 [25:48<03:00, 0.06it/s]
Training:  91%|█████████▏| 88/96 [26:24<02:24, 0.06it/s]
Training:  94%|█████████▍| 91/96 [27:18<01:30, 0.06it/s]
Training:  96%|█████████▋| 93/96 [27:54<00:54, 0.06it/s]
Training: 100%|██████████| 96/96 [28:48<00:00, 0.06it/s]
Evaluating:   0%|          | 0/27 [00:00<?, ?it/s]
Evaluating:   3%|▎         | 1/27 [00:06<02:36, 0.17it/s]
Evaluating:   3%|▎         | 1/27 [00:06<02:36, 0.17it/s]
Evaluating:   7%|▋         | 2/27 [00:12<02:30, 0.17it/s]
Evaluating:  14%|█▍        | 4/27 [00:24<02:18, 0.17it/s]
Evaluating:  18%|█▊        | 5/27 [00:30<02:12, 0.17it/s]
Evaluating:  18%|█▊        | 5/27 [00:30<02:12, 0.17it/s]
Evaluating:  25%|██▌       | 7/27 [00:42<02:00, 0.17it/s]
Evaluating:  29%|██▉       | 8/27 [00:48<01:54, 0.17it/s]
Evaluating:  29%|██▉       | 8/27 [00:48<01:54, 0.17it/s]
Evaluating:  33%|███▎      | 9/27 [00:54<01:48, 0.17it/s]
Evaluating:  40%|████      | 11/27 [01:06<01:36, 0.17it/s]
Evaluating:  40%|████      | 11/27 [01:06<01:36, 0.17it/s]
Evaluating:  44%|████▍     | 12/27 [01:12<01:30, 0.17it/s]
Evaluating:  51%|█████▏    | 14/27 [01:24<01:18, 0.17it/s]
Evaluating:  55%|█████▌    | 15/27 [01:30<01:12, 0.17it/s]
Evaluating:  55%|█████▌    | 15/27 [01:30<01:12, 0.17it/s]
Evaluating:  62%|██████▎   | 17/27 [01:42<01:00, 0.17it/s]
Evaluating:  66%|██████▋   | 18/27 [01:48<00:54, 0.17it/s]
Evaluating:  66%|██████▋   | 18/27 [01:48<00:54, 0.17it/s]
Evaluating:  70%|███████   | 19/27 [01:54<00:48, 0.17it/s]
Evaluating:  77%|███████▊  | 21/27 [02:06<00:36, 0.17it/s]
Evaluating:  77%|███████▊  | 21/27 [02:06<00:36, 0.17it/s]
Evaluating:  81%|████████▏ | 22/27 [02:12<00:30, 0.17it/s]
Evaluating:  88%|████████▉ | 24/27 [02:24<00:18, 0.17it/s]
Evaluating:  92%|█████████▎| 25/27 [02:30<00:12, 0.17it/s]
Evaluating:  92%|█████████▎| 25/27 [02:30<00:12, 0.17it/s]
Evaluating: 100%|██████████| 27/27 [02:42<00:00, 0.17it/s]
[2025-11-24 11:46:58] Epoch 40/200:
[2025-11-24 11:46:58] Training Loss: 0.1180
[2025-11-24 11:46:58] Test Loss: 0.1334
[2025-11-24 11:46:58] Saved best protein model with loss: 0.1334
Training:   2%|▏         | 2/96 [00:36<28:12, 0.06it/s]
Training:   4%|▍         | 4/96 [01:12<27:36, 0.06it/s]
Training:   7%|▋         | 7/96 [02:06<26:42, 0.06it/s]
Training:   9%|▉         | 9/96 [02:42<26:06, 0.06it/s]
Training:  11%|█▏        | 11/96 [03:18<25:30, 0.06it/s]
Training:  14%|█▍        | 14/96 [04:12<24:36, 0.06it/s]
Training:  16%|█▋        | 16/96 [04:48<24:00, 0.06it/s]
Training:  19%|█▉        | 19/96 [05:42<23:06, 0.06it/s]
Training:  21%|██▏       | 21/96 [06:18<22:30, 0.06it/s]
Training:  25%|██▌       | 24/96 [07:12<21:36, 0.06it/s]
Training:  26%|██▌       | 25/96 [07:30<21:18, 0.06it/s]
Training:  29%|██▉       | 28/96 [08:24<20:24, 0.06it/s]
Training:  31%|███▏      | 30/96 [09:00<19:48, 0.06it/s]
Training:  34%|███▍      | 33/96 [09:54<18:54, 0.06it/s]
Training:  36%|███▋      | 35/96 [10:30<18:18, 0.06it/s]
Training:  39%|███▉      | 38/96 [11:24<17:24, 0.06it/s]
Training:  41%|████▏     | 40/96 [12:00<16:48, 0.06it/s]
Training:  44%|████▍     | 43/96 [12:54<15:54, 0.06it/s]
Training:  46%|████▋     | 45/96 [13:30<15:18, 0.06it/s]
Training:  50%|█████     | 48/96 [14:24<14:24, 0.06it/s]
Training:  51%|█████     | 49/96 [14:42<14:06, 0.06it/s]
Training:  54%|█████▍    | 52/96 [15:36<13:12, 0.06it/s]
Training:  56%|█████▋    | 54/96 [16:12<12:36, 0.06it/s]
Training:  59%|█████▉    | 57/96 [17:06<11:42, 0.06it/s]
Training:  61%|██████▏   | 59/96 [17:42<11:06, 0.06it/s]
Training:  64%|██████▍   | 62/96 [18:36<10:12, 0.06it/s]
Training:  66%|██████▋   | 64/96 [19:12<09:36, 0.06it/s]
Training:  69%|██████▉   | 67/96 [20:06<08:42, 0.06it/s]
Training:  71%|███████▏  | 69/96 [20:42<08:06, 0.06it/s]
Training:  75%|███████▌  | 72/96 [21:36<07:12, 0.06it/s]
Training:  76%|███████▌  | 73/96 [21:54<06:54, 0.06it/s]
Training:  79%|███████▉  | 76/96 [22:48<06:00, 0.06it/s]
Training:  81%|████████▏ | 78/96 [23:24<05:24, 0.06it/s]
Training:  84%|████████▍ | 81/96 [24:18<04:30, 0.06it/s]
Training:  86%|████████▋ | 83/96 [24:54<03:54, 0.06it/s]
Training:  89%|████████▉ | 86/96 [25:48<03:00, 0.06it/s]
Training:  91%|█████████▏| 88/96 [26:24<02:24, 0.06it/s]
Training:  94%|█████████▍| 91/96 [27:18<01:30, 0.06it/s]
Training:  96%|█████████▋| 93/96 [27:54<00:54, 0.06it/s]
Training: 100%|██████████| 96/96 [28:48<00:00, 0.06it/s]
Evaluating:   0%|          | 0/27 [00:00<?, ?it/s]
Evaluating:   3%|▎         | 1/27 [00:06<02:36, 0.17it/s]
Evaluating:   3%|▎         | 1/27 [00:06<02:36, 0.17it/s]
Evaluating:   7%|▋         | 2/27 [00:12<02:30, 0.17it/s]
Evaluating:  14%|█▍        | 4/27 [00:24<02:18, 0.17it/s]
Evaluating:  18%|█▊        | 5/27 [00:30<02:12, 0.17it/s]
Evaluating:  18%|█▊        | 5/27 [00:30<02:12, 0.17it/s]
Evaluating:  25%|██▌       | 7/27 [00:42<02:00, 0.17it/s]
Evaluating:  29%|██▉       | 8/27 [00:48<01:54, 0.17it/s]
Evaluating:  29%|██▉       | 8/27 [00:48<01:54, 0.17it/s]
Evaluating:  33%|███▎      | 9/27 [00:54<01:48, 0.17it/s]
Evaluating:  40%|████      | 11/27 [01:06<01:36, 0.17it/s]
Evaluating:  40%|████      | 11/27 [01:06<01:36, 0.17it/s]
Evaluating:  44%|████▍     | 12/27 [01:12<01:30, 0.17it/s]
Evaluating:  51%|█████▏    | 14/27 [01:24<01:18, 0.17it/s]
Evaluating:  55%|█████▌    | 15/27 [01:30<01:12, 0.17it/s]
Evaluating:  55%|█████▌    | 15/27 [01:30<01:12, 0.17it/s]
Evaluating:  62%|██████▎   | 17/27 [01:42<01:00, 0.17it/s]
Evaluating:  66%|██████▋   | 18/27 [01:48<00:54, 0.17it/s]
Evaluating:  66%|██████▋   | 18/27 [01:48<00:54, 0.17it/s]
Evaluating:  70%|███████   | 19/27 [01:54<00:48, 0.17it/s]
Evaluating:  77%|███████▊  | 21/27 [02:06<00:36, 0.17it/s]
Evaluating:  77%|███████▊  | 21/27 [02:06<00:36, 0.17it/s]
Evaluating:  81%|████████▏ | 22/27 [02:12<00:30, 0.17it/s]
Evaluating:  88%|████████▉ | 24/27 [02:24<00:18, 0.17it/s]
Evaluating:  92%|█████████▎| 25/27 [02:30<00:12, 0.17it/s]
Evaluating:  92%|█████████▎| 25/27 [02:30<00:12, 0.17it/s]
Evaluating: 100%|██████████| 27/27 [02:42<00:00, 0.17it/s]
[2025-11-24 12:13:34] Epoch 60/200:
[2025-11-24 12:13:34] Training Loss: 0.1063
[2025-11-24 12:13:34] Test Loss: 0.1219
[2025-11-24 12:13:34] Saved best protein model with loss: 0.1219
Training:   2%|▏         | 2/96 [00:36<28:12, 0.06it/s]
Training:   4%|▍         | 4/96 [01:12<27:36, 0.06it/s]
Training:   7%|▋         | 7/96 [02:06<26:42, 0.06it/s]
Training:   9%|▉         | 9/96 [02:42<26:06, 0.06it/s]
Training:  11%|█▏        | 11/96 [03:18<25:30, 0.06it/s]
Training:  14%|█▍        | 14/96 [04:12<24:36, 0.06it/s]
Training:  16%|█▋        | 16/96 [04:48<24:00, 0.06it/s]
Training:  19%|█▉        | 19/96 [05:42<23:06, 0.06it/s]
Training:  21%|██▏       | 21/96 [06:18<22:30, 0.06it/s]
Training:  25%|██▌       | 24/96 [07:12<21:36, 0.06it/s]
Training:  26%|██▌       | 25/96 [07:30<21:18, 0.06it/s]
Training:  29%|██▉       | 28/96 [08:24<20:24, 0.06it/s]
Training:  31%|███▏      | 30/96 [09:00<19:48, 0.06it/s]
Training:  34%|███▍      | 33/96 [09:54<18:54, 0.06it/s]
Training:  36%|███▋      | 35/96 [10:30<18:18, 0.06it/s]
Training:  39%|███▉      | 38/96 [11:24<17:24, 0.06it/s]
Training:  41%|████▏     | 40/96 [12:00<16:48, 0.06it/s]
Training:  44%|████▍     | 43/96 [12:54<15:54, 0.06it/s]
Training:  46%|████▋     | 45/96 [13:30<15:18, 0.06it/s]
Training:  50%|█████     | 48/96 [14:24<14:24, 0.06it/s]
Training:  51%|█████     | 49/96 [14:42<14:06, 0.06it/s]
Training:  54%|█████▍    | 52/96 [15:36<13:12, 0.06it/s]
Training:  56%|█████▋    | 54/96 [16:12<12:36, 0.06it/s]
Training:  59%|█████▉    | 57/96 [17:06<11:42, 0.06it/s]
Training:  61%|██████▏   | 59/96 [17:42<11:06, 0.06it/s]
Training:  64%|██████▍   | 62/96 [18:36<10:12, 0.06it/s]
Training:  66%|██████▋   | 64/96 [19:12<09:36, 0.06it/s]
Training:  69%|██████▉   | 67/96 [20:06<08:42, 0.06it/s]
Training:  71%|███████▏  | 69/96 [20:42<08:06, 0.06it/s]
Training:  75%|███████▌  | 72/96 [21:36<07:12, 0.06it/s]
Training:  76%|███████▌  | 73/96 [21:54<06:54, 0.06it/s]
Training:  79%|███████▉  | 76/96 [22:48<06:00, 0.06it/s]
Training:  81%|████████▏ | 78/96 [23:24<05:24, 0.06it/s]
Training:  84%|████████▍ | 81/96 [24:18<04:30, 0.06it/s]
Training:  86%|████████▋ | 83/96 [24:54<03:54, 0.06it/s]
Training:  89%|████████▉ | 86/96 [25:48<03:00, 0.06it/s]
Training:  91%|█████████▏| 88/96 [26:24<02:24, 0.06it/s]
Training:  94%|█████████▍| 91/96 [27:18<01:30, 0.06it/s]
Training:  96%|█████████▋| 93/96 [27:54<00:54, 0.06it/s]
Training: 100%|██████████| 96/96 [28:48<00:00, 0.06it/s]
Evaluating:   0%|          | 0/27 [00:00<?, ?it/s]
Evaluating:   3%|▎         | 1/27 [00:06<02:36, 0.17it/s]
Evaluating:   3%|▎         | 1/27 [00:06<02:36, 0.17it/s]
Evaluating:   7%|▋         | 2/27 [00:12<02:30, 0.17it/s]
Evaluating:  14%|█▍        | 4/27 [00:24<02:18, 0.17it/s]
Evaluating:  18%|█▊        | 5/27 [00:30<02:12, 0.17it/s]
Evaluating:  18%|█▊        | 5/27 [00:30<02:12, 0.17it/s]
Evaluating:  25%|██▌       | 7/27 [00:42<02:00, 0.17it/s]
Evaluating:  29%|██▉       | 8/27 [00:48<01:54, 0.17it/s]
Evaluating:  29%|██▉       | 8/27 [00:48<01:54, 0.17it/s]
Evaluating:  33%|███▎      | 9/27 [00:54<01:48, 0.17it/s]
Evaluating:  40%|████      | 11/27 [01:06<01:36, 0.17it/s]
Evaluating:  40%|████      | 11/27 [01:06<01:36, 0.17it/s]
Evaluating:  44%|████▍     | 12/27 [01:12<01:30, 0.17it/s]
Evaluating:  51%|█████▏    | 14/27 [01:24<01:18, 0.17it/s]
Evaluating:  55%|█████▌    | 15/27 [01:30<01:12, 0.17it/s]
Evaluating:  55%|█████▌    | 15/27 [01:30<01:12, 0.17it/s]
Evaluating:  62%|██████▎   | 17/27 [01:42<01:00, 0.17it/s]
Evaluating:  66%|██████▋   | 18/27 [01:48<00:54, 0.17it/s]
Evaluating:  66%|██████▋   | 18/27 [01:48<00:54, 0.17it/s]
Evaluating:  70%|███████   | 19/27 [01:54<00:48, 0.17it/s]
Evaluating:  77%|███████▊  | 21/27 [02:06<00:36, 0.17it/s]
Evaluating:  77%|███████▊  | 21/27 [02:06<00:36, 0.17it/s]
Evaluating:  81%|████████▏ | 22/27 [02:12<00:30, 0.17it/s]
Evaluating:  88%|████████▉ | 24/27 [02:24<00:18, 0.17it/s]
Evaluating:  92%|█████████▎| 25/27 [02:30<00:12, 0.17it/s]
Evaluating:  92%|█████████▎| 25/27 [02:30<00:12, 0.17it/s]
Evaluating: 100%|██████████| 27/27 [02:42<00:00, 0.17it/s]
[2025-11-24 12:36:04] Epoch 80/200:
[2025-11-24 12:36:04] Training Loss: 0.0908
[2025-11-24 12:36:04] Test Loss: 0.1059
Training:   2%|▏         | 2/96 [00:36<28:12, 0.06it/s]
Training:   4%|▍         | 4/96 [01:12<27:36, 0.06it/s]
Training:   7%|▋         | 7/96 [02:06<26:42, 0.06it/s]
Training:   9%|▉         | 9/96 [02:42<26:06, 0.06it/s]
Training:  11%|█▏        | 11/96 [03:18<25:30, 0.06it/s]
Training:  14%|█▍        | 14/96 [04:12<24:36, 0.06it/s]
Training:  16%|█▋        | 16/96 [04:48<24:00, 0.06it/s]
Training:  19%|█▉        | 19/96 [05:42<23:06, 0.06it/s]
Training:  21%|██▏       | 21/96 [06:18<22:30, 0.06it/s]
Training:  25%|██▌       | 24/96 [07:12<21:36, 0.06it/s]
Training:  26%|██▌       | 25/96 [07:30<21:18, 0.06it/s]
Training:  29%|██▉       | 28/96 [08:24<20:24, 0.06it/s]
Training:  31%|███▏      | 30/96 [09:00<19:48, 0.06it/s]
Training:  34%|███▍      | 33/96 [09:54<18:54, 0.06it/s]
Training:  36%|███▋      | 35/96 [10:30<18:18, 0.06it/s]
Training:  39%|███▉      | 38/96 [11:24<17:24, 0.06it/s]
Training:  41%|████▏     | 40/96 [12:00<16:48, 0.06it/s]
Training:  44%|████▍     | 43/96 [12:54<15:54, 0.06it/s]
Training:  46%|████▋     | 45/96 [13:30<15:18, 0.06it/s]
Training:  50%|█████     | 48/96 [14:24<14:24, 0.06it/s]
Training:  51%|█████     | 49/96 [14:42<14:06, 0.06it/s]
Training:  54%|█████▍    | 52/96 [15:36<13:12, 0.06it/s]
Training:  56%|█████▋    | 54/96 [16:12<12:36, 0.06it/s]
Training:  59%|█████▉    | 57/96 [17:06<11:42, 0.06it/s]
Training:  61%|██████▏   | 59/96 [17:42<11:06, 0.06it/s]
Training:  64%|██████▍   | 62/96 [18:36<10:12, 0.06it/s]
Training:  66%|██████▋   | 64/96 [19:12<09:36, 0.06it/s]
Training:  69%|██████▉   | 67/96 [20:06<08:42, 0.06it/s]
Training:  71%|███████▏  | 69/96 [20:42<08:06, 0.06it/s]
Training:  75%|███████▌  | 72/96 [21:36<07:12, 0.06it/s]
Training:  76%|███████▌  | 73/96 [21:54<06:54, 0.06it/s]
Training:  79%|███████▉  | 76/96 [22:48<06:00, 0.06it/s]
Training:  81%|████████▏ | 78/96 [23:24<05:24, 0.06it/s]
Training:  84%|████████▍ | 81/96 [24:18<04:30, 0.06it/s]
Training:  86%|████████▋ | 83/96 [24:54<03:54, 0.06it/s]
Training:  89%|████████▉ | 86/96 [25:48<03:00, 0.06it/s]
Training:  91%|█████████▏| 88/96 [26:24<02:24, 0.06it/s]
Training:  94%|█████████▍| 91/96 [27:18<01:30, 0.06it/s]
Training:  96%|█████████▋| 93/96 [27:54<00:54, 0.06it/s]
Training: 100%|██████████| 96/96 [28:48<00:00, 0.06it/s]
Evaluating:   0%|          | 0/27 [00:00<?, ?it/s]
Evaluating:   3%|▎         | 1/27 [00:06<02:36, 0.17it/s]
Evaluating:   3%|▎         | 1/27 [00:06<02:36, 0.17it/s]
Evaluating:   7%|▋         | 2/27 [00:12<02:30, 0.17it/s]
Evaluating:  14%|█▍        | 4/27 [00:24<02:18, 0.17it/s]
Evaluating:  18%|█▊        | 5/27 [00:30<02:12, 0.17it/s]
Evaluating:  18%|█▊        | 5/27 [00:30<02:12, 0.17it/s]
Evaluating:  25%|██▌       | 7/27 [00:42<02:00, 0.17it/s]
Evaluating:  29%|██▉       | 8/27 [00:48<01:54, 0.17it/s]
Evaluating:  29%|██▉       | 8/27 [00:48<01:54, 0.17it/s]
Evaluating:  33%|███▎      | 9/27 [00:54<01:48, 0.17it/s]
Evaluating:  40%|████      | 11/27 [01:06<01:36, 0.17it/s]
Evaluating:  40%|████      | 11/27 [01:06<01:36, 0.17it/s]
Evaluating:  44%|████▍     | 12/27 [01:12<01:30, 0.17it/s]
Evaluating:  51%|█████▏    | 14/27 [01:24<01:18, 0.17it/s]
Evaluating:  55%|█████▌    | 15/27 [01:30<01:12, 0.17it/s]
Evaluating:  55%|█████▌    | 15/27 [01:30<01:12, 0.17it/s]
Evaluating:  62%|██████▎   | 17/27 [01:42<01:00, 0.17it/s]
Evaluating:  66%|██████▋   | 18/27 [01:48<00:54, 0.17it/s]
Evaluating:  66%|██████▋   | 18/27 [01:48<00:54, 0.17it/s]
Evaluating:  70%|███████   | 19/27 [01:54<00:48, 0.17it/s]
Evaluating:  77%|███████▊  | 21/27 [02:06<00:36, 0.17it/s]
Evaluating:  77%|███████▊  | 21/27 [02:06<00:36, 0.17it/s]
Evaluating:  81%|████████▏ | 22/27 [02:12<00:30, 0.17it/s]
Evaluating:  88%|████████▉ | 24/27 [02:24<00:18, 0.17it/s]
Evaluating:  92%|█████████▎| 25/27 [02:30<00:12, 0.17it/s]
Evaluating:  92%|█████████▎| 25/27 [02:30<00:12, 0.17it/s]
Evaluating: 100%|██████████| 27/27 [02:42<00:00, 0.17it/s]
[2025-11-24 13:00:05] Epoch 100/200:
[2025-11-24 13:00:05] Training Loss: 0.1019
[2025-11-24 13:00:05] Test Loss: 0.1191
Training:   2%|▏         | 2/96 [00:36<28:12, 0.06it/s]
Training:   4%|▍         | 4/96 [01:12<27:36, 0.06it/s]
Training:   7%|▋         | 7/96 [02:06<26:42, 0.06it/s]
Training:   9%|▉         | 9/96 [02:42<26:06, 0.06it/s]
Training:  11%|█▏        | 11/96 [03:18<25:30, 0.06it/s]
Training:  14%|█▍        | 14/96 [04:12<24:36, 0.06it/s]
Training:  16%|█▋        | 16/96 [04:48<24:00, 0.06it/s]
Training:  19%|█▉        | 19/96 [05:42<23:06, 0.06it/s]
Training:  21%|██▏       | 21/96 [06:18<22:30, 0.06it/s]
Training:  25%|██▌       | 24/96 [07:12<21:36, 0.06it/s]
Training:  26%|██▌       | 25/96 [07:30<21:18, 0.06it/s]
Training:  29%|██▉       | 28/96 [08:24<20:24, 0.06it/s]
Training:  31%|███▏      | 30/96 [09:00<19:48, 0.06it/s]
Training:  34%|███▍      | 33/96 [09:54<18:54, 0.06it/s]
Training:  36%|███▋      | 35/96 [10:30<18:18, 0.06it/s]
Training:  39%|███▉      | 38/96 [11:24<17:24, 0.06it/s]
Training:  41%|████▏     | 40/96 [12:00<16:48, 0.06it/s]
Training:  44%|████▍     | 43/96 [12:54<15:54, 0.06it/s]
Training:  46%|████▋     | 45/96 [13:30<15:18, 0.06it/s]
Training:  50%|█████     | 48/96 [14:24<14:24, 0.06it/s]
Training:  51%|█████     | 49/96 [14:42<14:06, 0.06it/s]
Training:  54%|█████▍    | 52/96 [15:36<13:12, 0.06it/s]
Training:  56%|█████▋    | 54/96 [16:12<12:36, 0.06it/s]
Training:  59%|█████▉    | 57/96 [17:06<11:42, 0.06it/s]
Training:  61%|██████▏   | 59/96 [17:42<11:06, 0.06it/s]
Training:  64%|██████▍   | 62/96 [18:36<10:12, 0.06it/s]
Training:  66%|██████▋   | 64/96 [19:12<09:36, 0.06it/s]
Training:  69%|██████▉   | 67/96 [20:06<08:42, 0.06it/s]
Training:  71%|███████▏  | 69/96 [20:42<08:06, 0.06it/s]
Training:  75%|███████▌  | 72/96 [21:36<07:12, 0.06it/s]
Training:  76%|███████▌  | 73/96 [21:54<06:54, 0.06it/s]
Training:  79%|███████▉  | 76/96 [22:48<06:00, 0.06it/s]
Training:  81%|████████▏ | 78/96 [23:24<05:24, 0.06it/s]
Training:  84%|████████▍ | 81/96 [24:18<04:30, 0.06it/s]
Training:  86%|████████▋ | 83/96 [24:54<03:54, 0.06it/s]
Training:  89%|████████▉ | 86/96 [25:48<03:00, 0.06it/s]
Training:  91%|█████████▏| 88/96 [26:24<02:24, 0.06it/s]
Training:  94%|█████████▍| 91/96 [27:18<01:30, 0.06it/s]
Training:  96%|█████████▋| 93/96 [27:54<00:54, 0.06it/s]
Training: 100%|██████████| 96/96 [28:48<00:00, 0.06it/s]
Evaluating:   0%|          | 0/27 [00:00<?, ?it/s]
Evaluating:   3%|▎         | 1/27 [00:06<02:36, 0.17it/s]
Evaluating:   3%|▎         | 1/27 [00:06<02:36, 0.17it/s]
Evaluating:   7%|▋         | 2/27 [00:12<02:30, 0.17it/s]
Evaluating:  14%|█▍        | 4/27 [00:24<02:18, 0.17it/s]
Evaluating:  18%|█▊        | 5/27 [00:30<02:12, 0.17it/s]
Evaluating:  18%|█▊        | 5/27 [00:30<02:12, 0.17it/s]
Evaluating:  25%|██▌       | 7/27 [00:42<02:00, 0.17it/s]
Evaluating:  29%|██▉       | 8/27 [00:48<01:54, 0.17it/s]
Evaluating:  29%|██▉       | 8/27 [00:48<01:54, 0.17it/s]
Evaluating:  33%|███▎      | 9/27 [00:54<01:48, 0.17it/s]
Evaluating:  40%|████      | 11/27 [01:06<01:36, 0.17it/s]
Evaluating:  40%|████      | 11/27 [01:06<01:36, 0.17it/s]
Evaluating:  44%|████▍     | 12/27 [01:12<01:30, 0.17it/s]
Evaluating:  51%|█████▏    | 14/27 [01:24<01:18, 0.17it/s]
Evaluating:  55%|█████▌    | 15/27 [01:30<01:12, 0.17it/s]
Evaluating:  55%|█████▌    | 15/27 [01:30<01:12, 0.17it/s]
Evaluating:  62%|██████▎   | 17/27 [01:42<01:00, 0.17it/s]
Evaluating:  66%|██████▋   | 18/27 [01:48<00:54, 0.17it/s]
Evaluating:  66%|██████▋   | 18/27 [01:48<00:54, 0.17it/s]
Evaluating:  70%|███████   | 19/27 [01:54<00:48, 0.17it/s]
Evaluating:  77%|███████▊  | 21/27 [02:06<00:36, 0.17it/s]
Evaluating:  77%|███████▊  | 21/27 [02:06<00:36, 0.17it/s]
Evaluating:  81%|████████▏ | 22/27 [02:12<00:30, 0.17it/s]
Evaluating:  88%|████████▉ | 24/27 [02:24<00:18, 0.17it/s]
Evaluating:  92%|█████████▎| 25/27 [02:30<00:12, 0.17it/s]
Evaluating:  92%|█████████▎| 25/27 [02:30<00:12, 0.17it/s]
Evaluating: 100%|██████████| 27/27 [02:42<00:00, 0.17it/s]
[2025-11-24 13:24:18] Epoch 120/200:
[2025-11-24 13:24:18] Training Loss: 0.0806
[2025-11-24 13:24:18] Test Loss: 0.0938
[2025-11-24 13:48:02] Early stopping at epoch 120
[2025-11-24 13:51:02] Evaluating final protein model on test set...

[2025-11-24 13:51:02] Protein Model Evaluation Results:
[2025-11-24 13:51:02] Metric     Value
[2025-11-24 13:51:02]    MSE    0.038350
[2025-11-24 13:51:02]    PCC    0.699588
[2025-11-24 13:51:02]    R2     0.307233
[2025-11-24 13:51:02]    MSE_DE 0.292182
[2025-11-24 13:51:02]    PCC_DE 0.660974
[2025-11-24 13:51:02]    R2_DE  0.578912

[2025-11-24 13:51:02] Model and evaluation results saved to: cite_protein_final_model_20251124_081523.pt

[2025-11-24 13:51:02] Final Evaluation Results:
[2025-11-24 13:51:02] Metric     Value                                           Best_Params
[2025-11-24 13:51:02]    MSE      0.038350   {"n_hidden": 256, "n_layers": 3, "n_heads": 4, ...
[2025-11-24 13:51:02]    PCC      0.699588   {"n_hidden": 256, "n_layers": 3, "n_heads": 4, ...
[2025-11-24 13:51:02]    R2       0.307233   {"n_hidden": 256, "n_layers": 3, "n_heads": 4, ...
[2025-11-24 13:51:02]    MSE_DE   0.292182   {"n_hidden": 256, "n_layers": 3, "n_heads": 4, ...
[2025-11-24 13:51:02]    PCC_DE   0.660974   {"n_hidden": 256, "n_layers": 3, "n_heads": 4, ...
[2025-11-24 13:51:02]    R2_DE    0.578912   {"n_hidden": 256, "n_layers": 3, "n_heads": 4, ...
